smartctl 7.1 2019-12-30 r5022 [FreeBSD 12.2-RELEASE-p2 amd64] (local build)
Copyright (C) 2002-19, Bruce Allen, Christian Franke, www.smartmontools.org

=== START OF INFORMATION SECTION ===
Model Family:     Maxtor DiamondMax Plus 9
Device Model:     Maxtor 6Y080M0
Serial Number:    Y2L1FSJE
Firmware Version: YAR51HW0
User Capacity:    80,000,000,000 bytes [80.0 GB]
Sector Size:      512 bytes logical/physical
Device is:        In smartctl database [for details use: -P show]
ATA Version is:   ATA/ATAPI-7 T13/1532D revision 0
Local Time is:    Sun Feb  7 18:16:58 2021 MST
SMART support is: Available - device has SMART capability.
SMART support is: Enabled

=== START OF READ SMART DATA SECTION ===
SMART overall-health self-assessment test result: PASSED
See vendor-specific Attribute list for marginal Attributes.

General SMART Values:
Offline data collection status:  (0x80)	Offline data collection activity
					was never started.
					Auto Offline Data Collection: Enabled.
Self-test execution status:      (   0)	The previous self-test routine completed
					without error or no self-test has ever 
					been run.
Total time to complete Offline 
data collection: 		(  241) seconds.
Offline data collection
capabilities: 			 (0x5b) SMART execute Offline immediate.
					Auto Offline data collection on/off support.
					Suspend Offline collection upon new
					command.
					Offline surface scan supported.
					Self-test supported.
					No Conveyance Self-test supported.
					Selective Self-test supported.
SMART capabilities:            (0x0003)	Saves SMART data before entering
					power-saving mode.
					Supports SMART auto save timer.
Error logging capability:        (0x01)	Error logging supported.
					No General Purpose Logging support.
Short self-test routine 
recommended polling time: 	 (   2) minutes.
Extended self-test routine
recommended polling time: 	 (  36) minutes.

SMART Attributes Data Structure revision number: 16
Vendor Specific SMART Attributes with Thresholds:
ID# ATTRIBUTE_NAME          FLAG     VALUE WORST THRESH TYPE      UPDATED  WHEN_FAILED RAW_VALUE
  3 Spin_Up_Time            0x0027   226   225   063    Pre-fail  Always       -       6310
  4 Start_Stop_Count        0x0032   253   253   000    Old_age   Always       -       505
  5 Reallocated_Sector_Ct   0x0033   245   001   063    Pre-fail  Always   In_the_past 87
  6 Read_Channel_Margin     0x0001   253   253   100    Pre-fail  Offline      -       0
  7 Seek_Error_Rate         0x000a   253   252   000    Old_age   Always       -       0
  8 Seek_Time_Performance   0x0027   253   241   187    Pre-fail  Always       -       49678
  9 Power_On_Minutes        0x0032   246   246   000    Old_age   Always       -       312h+16m
 10 Spin_Retry_Count        0x002b   253   252   157    Pre-fail  Always       -       0
 11 Calibration_Retry_Count 0x002b   253   252   223    Pre-fail  Always       -       0
 12 Power_Cycle_Count       0x0032   252   252   000    Old_age   Always       -       512
192 Power-Off_Retract_Count 0x0032   253   253   000    Old_age   Always       -       0
193 Load_Cycle_Count        0x0032   253   253   000    Old_age   Always       -       0
194 Temperature_Celsius     0x0032   253   253   000    Old_age   Always       -       35
195 Hardware_ECC_Recovered  0x000a   253   252   000    Old_age   Always       -       3139
196 Reallocated_Event_Count 0x0008   223   223   000    Old_age   Offline      -       30
197 Current_Pending_Sector  0x0008   234   001   000    Old_age   Offline      -       201
198 Offline_Uncorrectable   0x0008   001   001   000    Old_age   Offline      -       7220
199 UDMA_CRC_Error_Count    0x0008   199   199   000    Old_age   Offline      -       0
200 Multi_Zone_Error_Rate   0x000a   253   252   000    Old_age   Always       -       0
201 Soft_Read_Error_Rate    0x000a   253   252   000    Old_age   Always       -       5
202 Data_Address_Mark_Errs  0x000a   251   231   000    Old_age   Always       -       3
203 Run_Out_Cancel          0x000b   250   243   180    Pre-fail  Always       -       2387
204 Soft_ECC_Correction     0x000a   253   216   000    Old_age   Always       -       1
205 Thermal_Asperity_Rate   0x000a   253   252   000    Old_age   Always       -       0
207 Spin_High_Current       0x002a   253   252   000    Old_age   Always       -       0
208 Spin_Buzz               0x002a   253   252   000    Old_age   Always       -       0
209 Offline_Seek_Performnce 0x0024   195   195   000    Old_age   Offline      -       0
 99 Unknown_Attribute       0x0004   253   253   000    Old_age   Offline      -       0
100 Unknown_Attribute       0x0004   253   253   000    Old_age   Offline      -       0
101 Unknown_Attribute       0x0004   253   253   000    Old_age   Offline      -       0

SMART Error Log Version: 1
Warning: ATA error count 57021 inconsistent with error log pointer 5

ATA Error Count: 57021 (device log contains only the most recent five errors)
	CR = Command Register [HEX]
	FR = Features Register [HEX]
	SC = Sector Count Register [HEX]
	SN = Sector Number Register [HEX]
	CL = Cylinder Low Register [HEX]
	CH = Cylinder High Register [HEX]
	DH = Device/Head Register [HEX]
	DC = Device Command Register [HEX]
	ER = Error register [HEX]
	ST = Status register [HEX]
Powered_Up_Time is measured from power on, and printed as
DDd+hh:mm:SS.sss where DD=days, hh=hours, mm=minutes,
SS=sec, and sss=millisec. It "wraps" after 49.710 days.

Error 57021 occurred at disk power-on lifetime: 2340 hours (97 days + 12 hours)
  When the command that caused the error occurred, the device was in an unknown state.

  After command completion occurred, registers were:
  ER ST SC SN CL CH DH
  -- -- -- -- -- -- --
  40 51 01 f5 36 a5 e0  Error: UNC 1 sectors at LBA = 0x00a536f5 = 10827509

  Commands leading to the command that caused the error were:
  CR FR SC SN CL CH DH DC   Powered_Up_Time  Command/Feature_Name
  -- -- -- -- -- -- -- --  ----------------  --------------------
  c8 da 01 f5 36 a5 e0 00   5d+03:55:02.912  READ DMA
  c8 da 01 0e a4 6f e0 00   5d+03:55:02.896  READ DMA
  c8 da 01 f5 36 a5 e0 00   5d+03:55:01.888  READ DMA
  c8 da 01 ef 01 64 e4 00   5d+03:55:01.872  READ DMA
  c8 da 01 f5 36 a5 e0 00   5d+03:55:00.848  READ DMA

Error 57020 occurred at disk power-on lifetime: 2340 hours (97 days + 12 hours)
  When the command that caused the error occurred, the device was in an unknown state.

  After command completion occurred, registers were:
  ER ST SC SN CL CH DH
  -- -- -- -- -- -- --
  40 51 01 f5 36 a5 e0  Error: UNC 1 sectors at LBA = 0x00a536f5 = 10827509

  Commands leading to the command that caused the error were:
  CR FR SC SN CL CH DH DC   Powered_Up_Time  Command/Feature_Name
  -- -- -- -- -- -- -- --  ----------------  --------------------
  c8 da 01 f5 36 a5 e0 00   5d+03:55:01.888  READ DMA
  c8 da 01 ef 01 64 e4 00   5d+03:55:01.872  READ DMA
  c8 da 01 f5 36 a5 e0 00   5d+03:55:00.848  READ DMA
  c8 da 01 ce 02 bb e7 00   5d+03:55:00.832  READ DMA
  c8 da 01 f5 36 a5 e0 00   5d+03:54:59.824  READ DMA

Error 57019 occurred at disk power-on lifetime: 2340 hours (97 days + 12 hours)
  When the command that caused the error occurred, the device was in an unknown state.

  After command completion occurred, registers were:
  ER ST SC SN CL CH DH
  -- -- -- -- -- -- --
  40 51 01 f5 36 a5 e0  Error: UNC 1 sectors at LBA = 0x00a536f5 = 10827509

  Commands leading to the command that caused the error were:
  CR FR SC SN CL CH DH DC   Powered_Up_Time  Command/Feature_Name
  -- -- -- -- -- -- -- --  ----------------  --------------------
  c8 da 01 f5 36 a5 e0 00   5d+03:55:00.848  READ DMA
  c8 da 01 ce 02 bb e7 00   5d+03:55:00.832  READ DMA
  c8 da 01 f5 36 a5 e0 00   5d+03:54:59.824  READ DMA
  c8 da 01 ff 30 91 e6 00   5d+03:54:59.808  READ DMA
  c8 da 01 f5 36 a5 e0 00   5d+03:54:58.800  READ DMA

Error 57018 occurred at disk power-on lifetime: 2340 hours (97 days + 12 hours)
  When the command that caused the error occurred, the device was in an unknown state.

  After command completion occurred, registers were:
  ER ST SC SN CL CH DH
  -- -- -- -- -- -- --
  40 51 01 f5 36 a5 e0  Error: UNC 1 sectors at LBA = 0x00a536f5 = 10827509

  Commands leading to the command that caused the error were:
  CR FR SC SN CL CH DH DC   Powered_Up_Time  Command/Feature_Name
  -- -- -- -- -- -- -- --  ----------------  --------------------
  c8 da 01 f5 36 a5 e0 00   5d+03:54:59.824  READ DMA
  c8 da 01 ff 30 91 e6 00   5d+03:54:59.808  READ DMA
  c8 da 01 f5 36 a5 e0 00   5d+03:54:58.800  READ DMA
  c8 da 01 2b 8b b2 e7 00   5d+03:54:58.784  READ DMA
  c8 da 01 f5 36 a5 e0 00   5d+03:54:57.760  READ DMA

Error 57017 occurred at disk power-on lifetime: 2340 hours (97 days + 12 hours)
  When the command that caused the error occurred, the device was in an unknown state.

  After command completion occurred, registers were:
  ER ST SC SN CL CH DH
  -- -- -- -- -- -- --
  40 51 01 f5 36 a5 e0  Error: UNC 1 sectors at LBA = 0x00a536f5 = 10827509

  Commands leading to the command that caused the error were:
  CR FR SC SN CL CH DH DC   Powered_Up_Time  Command/Feature_Name
  -- -- -- -- -- -- -- --  ----------------  --------------------
  c8 da 01 f5 36 a5 e0 00   5d+03:54:58.800  READ DMA
  c8 da 01 2b 8b b2 e7 00   5d+03:54:58.784  READ DMA
  c8 da 01 f5 36 a5 e0 00   5d+03:54:57.760  READ DMA
  c8 da 01 61 11 3d e8 00   5d+03:54:57.744  READ DMA
  c8 da 01 f5 36 a5 e0 00   5d+03:54:56.736  READ DMA

SMART Self-test log structure revision number 1
Num  Test_Description    Status                  Remaining  LifeTime(hours)  LBA_of_first_error
# 1  Short offline       Completed without error       00%         0         -

SMART Selective self-test log data structure revision number 1
 SPAN  MIN_LBA  MAX_LBA  CURRENT_TEST_STATUS
    1        0        0  Not_testing
    2        0        0  Not_testing
    3        0        0  Not_testing
    4        0        0  Not_testing
    5        0        0  Not_testing
Selective self-test flags (0x0):
  After scanning selected spans, do NOT read-scan remainder of disk.
If Selective self-test is pending on power-up, resume after 0 minute delay.

