ubuntu@ubuntu:~$ sudo smartctl -a /dev/nvme0n1
smartctl 6.6 2016-05-31 r4324 [x86_64-linux-4.15.0-20-generic] (local build)
Copyright (C) 2002-16, Bruce Allen, Christian Franke, www.smartmontools.org

=== START OF INFORMATION SECTION ===
Model Number:                       ADATA SX6000NP
Serial Number:                      2H5120005176
Firmware Version:                   V6005-a9
PCI Vendor/Subsystem ID:            0x10ec
IEEE OUI Identifier:                0x00e04c
Controller ID:                      22273
Number of Namespaces:               1
Namespace 1 Size/Capacity:          256,060,514,304 [256 GB]
Namespace 1 Formatted LBA Size:     512
Local Time is:                      Sun May 27 23:31:46 2018 UTC
Firmware Updates (0x0e):            7 Slots
Optional Admin Commands (0x0006):   Format Frmw_DL
Optional NVM Commands (0x0004):     DS_Mngmt
Maximum Data Transfer Size:         32 Pages
Warning  Comp. Temp. Threshold:     118 Celsius
Critical Comp. Temp. Threshold:     150 Celsius

Supported Power States
St Op     Max   Active     Idle   RL RT WL WT  Ent_Lat  Ex_Lat
 0 +    50.00W       -        -    0  0  0  0        0       0

Supported LBA Sizes (NSID 0x1)
Id Fmt  Data  Metadt  Rel_Perf
 0 +     512       0         0

=== START OF SMART DATA SECTION ===
SMART overall-health self-assessment test result: FAILED!
- media has been placed in read only mode

SMART/Health Information (NVMe Log 0x02, NSID 0x1)
Critical Warning:                   0x08
Temperature:                        60 Celsius
Available Spare:                    100%
Available Spare Threshold:          32%
Percentage Used:                    0%
Data Units Read:                    3,109,470 [1.59 TB]
Data Units Written:                 2,676,457 [1.37 TB]
Host Read Commands:                 40,101,775
Host Write Commands:                25,028,251
Controller Busy Time:               235,708,396,497,399,570
Power Cycles:                       259
Power On Hours:                     849
Unsafe Shutdowns:                   44
Media and Data Integrity Errors:    0
Error Information Log Entries:      52,433
Warning  Comp. Temperature Time:    0
Critical Comp. Temperature Time:    0

Error Information (NVMe Log 0x01, max 8 entries)
No Errors Logged