smartctl 7.0 2018-12-30 r4883 [x86_64-linux-4.19.34-1-lts] (local build)
Copyright (C) 2002-18, Bruce Allen, Christian Franke, www.smartmontools.org

=== START OF INFORMATION SECTION ===
Model Number:                       INTEL SSDPEDME016T4S
Serial Number:                      XXXXXXXXXXXXXXXXXX
Firmware Version:                   8DV1RA13
PCI Vendor ID:                      0x8086
PCI Vendor Subsystem ID:            0x108e
IEEE OUI Identifier:                0x5cd2e4
Controller ID:                      0
Number of Namespaces:               1
Namespace 1 Size/Capacity:          1,600,321,314,816 [1.60 TB]
Namespace 1 Formatted LBA Size:     512
Local Time is:                      Mon Sep 23 15:05:46 2019 UTC
Firmware Updates (0x02):            1 Slot
Optional Admin Commands (0x0006):   Format Frmw_DL
Optional NVM Commands (0x0006):     Wr_Unc DS_Mngmt
Maximum Data Transfer Size:         32 Pages

Supported Power States
St Op     Max   Active     Idle   RL RT WL WT  Ent_Lat  Ex_Lat
 0 +    25.00W       -        -    0  0  0  0        0       0

Supported LBA Sizes (NSID 0x1)
Id Fmt  Data  Metadt  Rel_Perf
 0 +     512       0         2
 1 -     512       8         2
 2 -     512      16         2
 3 -    4096       0         0
 4 -    4096       8         0
 5 -    4096      64         0
 6 -    4096     128         0

=== START OF SMART DATA SECTION ===
SMART overall-health self-assessment test result: PASSED

SMART/Health Information (NVMe Log 0x02)
Critical Warning:                   0x00
Temperature:                        46 Celsius
Available Spare:                    100%
Available Spare Threshold:          10%
Percentage Used:                    0%
Data Units Read:                    2,982,460 [1.52 TB]
Data Units Written:                 4,203,732 [2.15 TB]
Host Read Commands:                 15,336,520,010
Host Write Commands:                2,334,084,514
Controller Busy Time:               312
Power Cycles:                       185
Power On Hours:                     23,421
Unsafe Shutdowns:                   143
Media and Data Integrity Errors:    0
Error Information Log Entries:      0

Error Information (NVMe Log 0x01, max 64 entries)
No Errors Logged

[root@esxi1:/opt/intel/isdct] ./isdct show -intelssd

- Intel SSD DC P3600 Series CVMD4506002R1P6KGN -

Bootloader : 8B1B012E
DevicePath : vmhba4
DeviceStatus : Healthy
Firmware : 8DV1RA13
FirmwareUpdateAvailable : Please contact your Intel representative about firmware update for this drive.
Index : 0
ModelNumber : INTEL SSDPEDME016T4S
ProductFamily : Intel SSD DC P3600 Series
SerialNumber : XXXXXXXXXXXXXXXXXX

[root@esxi1:/opt/intel/isdct]