user@debian:~$ sudo smartctl -t long -a /dev/nvme0n1
smartctl 7.1 2019-12-30 r5022 [x86_64-linux-5.4.0-3-amd64] (local build)
Copyright (C) 2002-19, Bruce Allen, Christian Franke, www.smartmontools.org

=== START OF INFORMATION SECTION ===
Model Number:                       KINGSTON RBUSNS8154P3128GJ
Serial Number:                      50026B76825E7C99
Firmware Version:                   E8FK11.C
PCI Vendor/Subsystem ID:            0x2646
IEEE OUI Identifier:                0x0026b7
Total NVM Capacity:                 128,035,676,160 [128 GB]
Unallocated NVM Capacity:           0
Controller ID:                      0
Number of Namespaces:               1
Namespace 1 Size/Capacity:          128,035,676,160 [128 GB]
Namespace 1 Formatted LBA Size:     512
Namespace 1 IEEE EUI-64:            0026b7 6825e7c995
Local Time is:                      Tue Feb 25 21:07:07 2020 UTC
Firmware Updates (0x02):            1 Slot
Optional Admin Commands (0x0007):   Security Format Frmw_DL
Optional NVM Commands (0x001e):     Wr_Unc DS_Mngmt Wr_Zero Sav/Sel_Feat
Maximum Data Transfer Size:         512 Pages
Warning  Comp. Temp. Threshold:     84 Celsius
Critical Comp. Temp. Threshold:     88 Celsius

Supported Power States
St Op     Max   Active     Idle   RL RT WL WT  Ent_Lat  Ex_Lat
 0 +     7.90W  0.0790W       -    0  0  0  0      600     600
 1 +     7.90W  0.0790W       -    0  0  0  0      600     600
 2 +     7.90W  0.0790W       -    0  0  0  0      600     600
 3 -   0.1000W  0.0790W       -    3  3  3  3     1000    1000
 4 -   0.0050W  0.0790W       -    4  4  4  4   400000   90000

Supported LBA Sizes (NSID 0x1)
Id Fmt  Data  Metadt  Rel_Perf
 0 +     512       0         1
 1 -    4096       0         0

=== START OF SMART DATA SECTION ===
SMART overall-health self-assessment test result: PASSED

SMART/Health Information (NVMe Log 0x02)
Critical Warning:                   0x00
Temperature:                        36 Celsius
Available Spare:                    100%
Available Spare Threshold:          100%
Percentage Used:                    0%
Data Units Read:                    1,171,070 [599 GB]
Data Units Written:                 1,317,481 [674 GB]
Host Read Commands:                 1,394,354
Host Write Commands:                2,091,639
Controller Busy Time:               115
Power Cycles:                       19
Power On Hours:                     61
Unsafe Shutdowns:                   8
Media and Data Integrity Errors:    0
Error Information Log Entries:      147
Warning  Comp. Temperature Time:    0
Critical Comp. Temperature Time:    0
Temperature Sensor 2:               36 Celsius

Error Information (NVMe Log 0x01, max 16 entries)
Num   ErrCount  SQId   CmdId  Status  PELoc          LBA  NSID    VS
  0        147     2  0x00ff  0x0304      -            0     1     -
  1        146     2  0x00ff  0x0304      -            0     1     -
  2        145     2  0x00ff  0x0304      -            0     1     -
  3        144     2  0x00ff  0x0304      -            0     1     -
  4        143     2  0x00ff  0x0304      -            0     1     -
  5        142     2  0x00ff  0x0304      -            0     1     -
  6        141     3  0x0257  0x0305      -            0     1     -
  7        140     3  0x0257  0x0305      -            0     1     -
  8        139     3  0x0257  0x0305      -            0     1     -
  9        138     3  0x0257  0x0305      -            0     1     -
 10        137     3  0x0257  0x0305      -            0     1     -
 11        136     3  0x0257  0x0305      -            0     1     -
 12        135     4  0x03fb  0x0305      -            0     1     -
 13        134     4  0x03fb  0x0305      -            0     1     -
 14        133     4  0x03fb  0x0305      -            0     1     -
 15        132     4  0x03fb  0x0305      -            0     1     -