smartctl 7.0 2018-12-30 r4883 [x86_64-linux-5.1.8-1-MANJARO] (local build)
Copyright (C) 2002-18, Bruce Allen, Christian Franke, www.smartmontools.org

=== START OF INFORMATION SECTION ===
Model Number:                       KINGSTON SA1000M8240G
Serial Number:                      50026B7682A8859C
Firmware Version:                   E8FK11.R
PCI Vendor/Subsystem ID:            0x2646
IEEE OUI Identifier:                0x0026b7
Total NVM Capacity:                 240,057,409,536 [240 GB]
Unallocated NVM Capacity:           0
Controller ID:                      0
Number of Namespaces:               1
Namespace 1 Size/Capacity:          240,057,409,536 [240 GB]
Namespace 1 Formatted LBA Size:     512
Namespace 1 IEEE EUI-64:            0026b7 682a8859c5
Local Time is:                      Fri Jun 21 00:22:12 2019 EEST
Firmware Updates (0x02):            1 Slot
Optional Admin Commands (0x0007):   Security Format Frmw_DL
Optional NVM Commands (0x001e):     Wr_Unc DS_Mngmt Wr_Zero Sav/Sel_Feat
Maximum Data Transfer Size:         512 Pages
Warning  Comp. Temp. Threshold:     84 Celsius
Critical Comp. Temp. Threshold:     88 Celsius

Supported Power States
St Op     Max   Active     Idle   RL RT WL WT  Ent_Lat  Ex_Lat
 0 +     7.90W  0.0790W       -    0  0  0  0      600     600
 1 +     7.90W  0.0790W       -    0  0  0  0      600     600
 2 +     7.90W  0.0790W       -    0  0  0  0      600     600
 3 -   0.1000W  0.0790W       -    3  3  3  3     1000    1000
 4 -   0.0050W  0.0790W       -    4  4  4  4   400000   90000

Supported LBA Sizes (NSID 0x1)
Id Fmt  Data  Metadt  Rel_Perf
 0 +     512       0         1
 1 -    4096       0         0

=== START OF SMART DATA SECTION ===
SMART overall-health self-assessment test result: PASSED

SMART/Health Information (NVMe Log 0x02)
Critical Warning:                   0x00
Temperature:                        48 Celsius
Available Spare:                    100%
Available Spare Threshold:          100%
Percentage Used:                    0%
Data Units Read:                    65,037 [33.2 GB]
Data Units Written:                 90,911 [46.5 GB]
Host Read Commands:                 847,026
Host Write Commands:                475,782
Controller Busy Time:               2
Power Cycles:                       18
Power On Hours:                     5
Unsafe Shutdowns:                   4
Media and Data Integrity Errors:    0
Error Information Log Entries:      17
Warning  Comp. Temperature Time:    0
Critical Comp. Temperature Time:    0
Temperature Sensor 2:               48 Celsius

Error Information (NVMe Log 0x01, max 16 entries)
Num   ErrCount  SQId   CmdId  Status  PELoc          LBA  NSID    VS
  0         17     1  0x0053  0x0304      -            0     1     -
  1         16     1  0x0052  0x0304      -            0     1     -
  2         15     1  0x0051  0x0305      -            0     1     -
  3         14     1  0x0050  0x0305      -            0     1     -
  4         13     1  0x004f  0x0304      -            0     1     -
  5         12     1  0x004e  0x0304      -            0     1     -
  6         11     1  0x004d  0x0305      -            0     1     -
  7         10     1  0x004c  0x0305      -            0     1     -
  8          9     1  0x004b  0x0304      -            0     1     -
  9          8     1  0x004a  0x0304      -            0     1     -
 10          7     1  0x0049  0x0305      -            0     1     -
 11          6     0  0x0002  0x0005      -          208     0     -
 12          5     0  0x0002  0x0005      -          208     0     -
 13          4     0  0x0002  0x0005      -          208     0     -
 14          3     0  0x0002  0x0005      -          208     0     -
 15          2     0  0x0002  0x0005      -          208     0     -