mint smartmontools # ./smartctl -a /dev/nvme0
smartctl 6.6 (build date Mar 11 2017) [x86_64-linux-4.4.0-53-generic] (local build)
Copyright (C) 2002-17, Bruce Allen, Christian Franke, www.smartmontools.org

=== START OF INFORMATION SECTION ===
Model Number:                       PLEXTOR PX-256M8PeG
Serial Number:                      P02630104013
Firmware Version:                   1.01
PCI Vendor ID:                      0x14a4
PCI Vendor Subsystem ID:            0x1b4b
IEEE OUI Identifier:                0x002303
Total NVM Capacity:                 256,060,514,304 [256 GB]
Unallocated NVM Capacity:           0
Controller ID:                      1
Number of Namespaces:               1
Namespace 1 Size/Capacity:          256,060,514,304 [256 GB]
Namespace 1 Utilization:            0
Namespace 1 Formatted LBA Size:     512
Local Time is:                      Sat Mar 11 11:04:11 2017 UTC
Firmware Updates (0x14):            2 Slots, no Reset required
Optional Admin Commands (0x001f):   Security Format Frmw_DL NS_Mngmt *Other*
Optional NVM Commands (0x001f):     Comp Wr_Unc DS_Mngmt Wr_Zero Sav/Sel_Feat
Maximum Data Transfer Size:         32 Pages
Warning  Comp. Temp. Threshold:     85 Celsius
Critical Comp. Temp. Threshold:     95 Celsius

Supported Power States
St Op     Max   Active     Idle   RL RT WL WT  Ent_Lat  Ex_Lat
 0 +     8.00W       -        -    0  0  0  0        0       0
 1 +     4.00W       -        -    1  1  1  1        5       5
 2 +     2.10W       -        -    2  2  2  2        5       5
 3 -   0.1000W       -        -    3  3  3  3     5000    5000
 4 -   0.0100W       -        -    4  4  4  4    50000  100000

Supported LBA Sizes (NSID 0x1)
Id Fmt  Data  Metadt  Rel_Perf
 0 -     512       0         0

=== START OF SMART DATA SECTION ===
SMART overall-health self-assessment test result: PASSED

SMART/Health Information (NVMe Log 0x02, NSID 0xffffffff)
Critical Warning:                   0x00
Temperature:                        51 Celsius
Available Spare:                    100%
Available Spare Threshold:          0%
Percentage Used:                    0%
Data Units Read:                    335,912 [171 GB]
Data Units Written:                 861,546 [441 GB]
Host Read Commands:                 1,354,841
Host Write Commands:                5,569,195
Controller Busy Time:               32
Power Cycles:                       54
Power On Hours:                     53
Unsafe Shutdowns:                   50
Media and Data Integrity Errors:    0
Error Information Log Entries:      0
Warning  Comp. Temperature Time:    0
Critical Comp. Temperature Time:    0
Temperature Sensor 1:               51 Celsius

Error Information (NVMe Log 0x01, max 64 entries)
No Errors Logged