smartctl 6.5 2016-05-07 r4318 [x86_64-linux-4.15.4-300.fc27.x86_64] (local build)
Copyright (C) 2002-16, Bruce Allen, Christian Franke, www.smartmontools.org

=== START OF INFORMATION SECTION ===
Model Number:                       SAMSUNG MZVPW256HEGL-00000
Serial Number:                      S346NY0HC31142
Firmware Version:                   CXZ7300Q
PCI Vendor/Subsystem ID:            0x144d
IEEE OUI Identifier:                0x002538
Total NVM Capacity:                 256.060.514.304 [256 GB]
Unallocated NVM Capacity:           0
Controller ID:                      2
Number of Namespaces:               1
Namespace 1 Size/Capacity:          256.060.514.304 [256 GB]
Namespace 1 Formatted LBA Size:     512
Local Time is:                      Wed Feb 28 10:35:40 2018 CET
Firmware Updates (0x16):            3 Slots, no Reset required
Optional Admin Commands (0x0017):   Security Format Frmw_DL *Other*
Optional NVM Commands (0x001f):     Comp Wr_Unc DS_Mngmt Wr_Zero Sav/Sel_Feat
Warning  Comp. Temp. Threshold:     70 Celsius
Critical Comp. Temp. Threshold:     73 Celsius

Supported Power States
St Op     Max   Active     Idle   RL RT WL WT  Ent_Lat  Ex_Lat
 0 +     6.80W       -        -    0  0  0  0        0       0
 1 +     5.60W       -        -    1  1  1  1        0       0
 2 +     4.40W       -        -    2  2  2  2        0       0
 3 -   0.0400W       -        -    3  3  3  3      210    1500
 4 -   0.0050W       -        -    4  4  4  4     2200    6000

Supported LBA Sizes (NSID 0x1)
Id Fmt  Data  Metadt  Rel_Perf
 0 +     512       0         0

=== START OF SMART DATA SECTION ===
SMART overall-health self-assessment test result: PASSED

SMART/Health Information (NVMe Log 0x02, NSID 0xffffffff)
Critical Warning:                   0x00
Temperature:                        31 Celsius
Available Spare:                    100%
Available Spare Threshold:          10%
Percentage Used:                    3%
Data Units Read:                    31.822.982 [16,2 TB]
Data Units Written:                 11.421.903 [5,84 TB]
Host Read Commands:                 197.212.376
Host Write Commands:                168.541.335
Controller Busy Time:               5.169
Power Cycles:                       465
Power On Hours:                     1.274
Unsafe Shutdowns:                   13
Media and Data Integrity Errors:    8
Error Information Log Entries:      1.219
Warning  Comp. Temperature Time:    0
Critical Comp. Temperature Time:    0
Temperature Sensor 1:               31 Celsius
Temperature Sensor 2:               41 Celsius

Error Information (NVMe Log 0x01, max 64 entries)
Num   ErrCount  SQId   CmdId  Status  PELoc          LBA  NSID    VS
  0       1219     0  0x0059  0x4004  0x02c            0     0     -
  1       1218     0  0x0055  0x4004  0x02c            0     0     -
  2       1217     2  0x01bb  0x4502  0x000            0     1     -
  3       1216     8  0x034c  0x4502  0x000            0     1     -
  4       1215     8  0x02f3  0x4502  0x000            0     1     -
  5       1214     8  0x02f0  0x4502  0x000            0     1     -
  6       1213     0  0x001e  0x4004  0x02c            0     0     -
  7       1212     0  0x001d  0x4004  0x02c            0     0     -
  8       1211     0  0x004d  0x4004  0x02c            0     0     -
  9       1210     0  0x004b  0x4004  0x02c            0     0     -
 10       1209     4  0x0252  0x4502  0x000            0     1     -
 11       1208     2  0x032f  0x4502  0x000            0     1     -
 12       1207     2  0x02ee  0x4502  0x000            0     1     -
 13       1206     2  0x02e9  0x4502  0x000            0     1     -
 14       1205     0  0x001e  0x4004  0x02c            0     0     -
 15       1204     0  0x001d  0x4004  0x02c            0     0     -