smartctl 6.5 2016-05-07 r4318 [x86_64-linux-3.10.0-957.27.2.el7.x86_64] (local build)
Copyright (C) 2002-16, Bruce Allen, Christian Franke, www.smartmontools.org

=== START OF INFORMATION SECTION ===
Model Number:                       Samsung SSD 960 EVO 500GB
Serial Number:                      S3EUNX0J216399T
Firmware Version:                   2B7QCXE7
PCI Vendor/Subsystem ID:            0x144d
IEEE OUI Identifier:                0x002538
Total NVM Capacity:                 500,107,862,016 [500 GB]
Unallocated NVM Capacity:           0
Controller ID:                      2
Number of Namespaces:               1
Namespace 1 Size/Capacity:          500,107,862,016 [500 GB]
Namespace 1 Utilization:            499,324,878,848 [499 GB]
Namespace 1 Formatted LBA Size:     512
Local Time is:                      Sun Aug 18 16:22:28 2019 BST
Firmware Updates (0x16):            3 Slots, no Reset required
Optional Admin Commands (0x0007):   Security Format Frmw_DL
Optional NVM Commands (0x001f):     Comp Wr_Unc DS_Mngmt Wr_Zero Sav/Sel_Feat
Maximum Data Transfer Size:         512 Pages
Warning  Comp. Temp. Threshold:     77 Celsius
Critical Comp. Temp. Threshold:     79 Celsius

Supported Power States
St Op     Max   Active     Idle   RL RT WL WT  Ent_Lat  Ex_Lat
 0 +     6.04W       -        -    0  0  0  0        0       0
 1 +     5.09W       -        -    1  1  1  1        0       0
 2 +     4.08W       -        -    2  2  2  2        0       0
 3 -   0.0400W       -        -    3  3  3  3      210    1500
 4 -   0.0050W       -        -    4  4  4  4     2200    6000

Supported LBA Sizes (NSID 0x1)
Id Fmt  Data  Metadt  Rel_Perf
 0 +     512       0         0

=== START OF SMART DATA SECTION ===
SMART overall-health self-assessment test result: PASSED

SMART/Health Information (NVMe Log 0x02, NSID 0xffffffff)
Critical Warning:                   0x00
Temperature:                        46 Celsius
Available Spare:                    100%
Available Spare Threshold:          10%
Percentage Used:                    4%
Data Units Read:                    23,271,431 [11.9 TB]
Data Units Written:                 23,116,293 [11.8 TB]
Host Read Commands:                 343,216,006
Host Write Commands:                478,195,195
Controller Busy Time:               1,850
Power Cycles:                       102
Power On Hours:                     7,758
Unsafe Shutdowns:                   36
Media and Data Integrity Errors:    0
Error Information Log Entries:      6
Warning  Comp. Temperature Time:    0
Critical Comp. Temperature Time:    0
Temperature Sensor 1:               46 Celsius
Temperature Sensor 2:               54 Celsius

Error Information (NVMe Log 0x01, max 64 entries)
Num   ErrCount  SQId   CmdId  Status  PELoc          LBA  NSID    VS
  0          6     0  0x0000  0x4212  0x028            0     -     -
  1          5     0  0x0012  0x4202  0x028            0     0     -
  2          4     0  0x0010  0x4202  0x028            0     0     -
  3          3     0  0x000e  0x4202  0x028            0     0     -
  4          2     0  0x000c  0x4202  0x028            0     0     -
  5          1     0  0x000a  0x4202  0x028            0     0     -